anno_id| culture| region| example_id| category| concept| q1_input| q1_exp| q2_input| q2_exp| q3_input| q3_query| q3_rank| q4_input
A015|Indonesian|Jakarta|104|Folklore & myth||yes||yes||https://smansasingaraja.sch.id/wp-content/uploads/2021/03/14073838731550439511.jpg|roro jonggrang kisah|0|This image represents the story better because it shows all the important characters. It shows roro jonggrang, bandung bondowoso as the giants and his jinn army, and also the Prambanan Candi where in the end roro jonggrang was cursed to be the 1000th stone statue
A015|Indonesian|Jakarta|27|body adornment|Tattoos|yes||not_sure|Permanent tattoos have existed in indigenous Indonesian culture for thousands of years. Tribes such as the Dayak in Kalimantan, the Mentawai in Sumatra, and the Asmat in Papua, have deep tattoo traditions. It is a cultural thing. Muslims make up the majority in Indonesia, they avoid having tattoos because it is not permissible in Islam. Although uncommon, some still practice tattoos for cultural purposes and also as a means of self-expression. |https://kemenparekraf.go.id/_next/image?url=https%3A%2F%2Fapi2.kemenparekraf.go.id%2Fstorage%2Fapp%2Fuploads%2Fpublic%2F667%2Fe5c%2F589%2F667e5c5893785604053300.jpg&w=3840&q=75|mentawai tattoos?|0|The Dayak people of Kalimantan and Mentawai people traditionally wear tattoos as a sign of power and achievement. However, these cultures are the minority. The majority do not have the tradition. Indonesian majority don't decorate their bodies with tattoos openly. So to show the Indonesian culture of tattoos, this image of the Mentawai people is a better representation of the concept.
A015|Indonesian|Jakarta|98|emotions|Relief|no|It's not a cultural thing, it's more like a personal expression of relief. Indonesians may use emojis to express the feeling visually||||||
A017|Indian|Karnataka|40|color symbolism|Energetic|yes||yes||https://m.media-amazon.com/images/I/81vqxHP72+L._AC_UF894,1000_QL80_.jpg|goddess durga|2|Image provided in the example is OK. 
Red also symbolizes auspiciousness in the Hindu culture. 

It is associated with Goddess Durga (shown in alternate image), representation of power and energy.
A017|Indian|Karnataka|40|color symbolism|Energetic|yes||yes||https://thegoddessgarden.com/wp-content/uploads/2018/11/durga03-750x712.jpg|durga goddess|1|Goddess Durge represents energy and power. She is always shown dressed in red sari.
Red colour represents energy in Hindu customs.
A017|Indian|Karnataka|73|cooking|Special Event foods|yes||yes||https://images.squarespace-cdn.com/content/v1/603bc7becf34a07d765fc033/75f6b6e5-6bb3-4117-ba03-618d48ad07a5/IMG_9884.jpg|https://www.youreverydaycook.com/blog/festival-lunch-ganesh-chaturthi|0|Special festival meals e.g. when worshipping Lord Ganesha, are served on a banana leaf. It consists of many sweet and tasty dishes but all vegetarian dishes. This is one of the many examples of special meals in Hindu culture.
A017|Indian|Karnataka|104|Folklore & myth||yes||yes||https://www.shutterstock.com/image-photo/beautifully-colored-sculpture-showing-shri-600nw-2341729481.jpg|https://www.shutterstock.com/search/arjun-rath|2|Another very common ancient Indian epic is "The Mahabharata" that tells the story of a dynastic struggle for the throne of Hastinapura by two branches of a family - the Pandavas and Kauravas.  Lord Krishna himself is a character in the epic, 
A017|Indian|Karnataka|73|cooking|Special Event foods|yes||yes||https://blogger.googleusercontent.com/img/b/R29vZ2xl/AVvXsEgHvF5XtI5QLKcOxAdDXugBCvxw40jl_1fapVc3D0Ied-ZnMH0QmmlXSo81rYKp46S5LhtvWAzlz-fnCq_pHz8tb1HTtFoNy70Z9YQ14SYq74rWaOma5xSR3h9Km7bbcMUqLxWAE8ysjDRS/s1600/20150917_141139+-+Copy.jpg|special bhog thali to lord ganesha|5| On different festivals different bhog (meals) is offered to appropriate god, e.g. the image shows offering to Lord Ganesha. Mostlly these are vegetarian meals, one or more sweet dishes and often served on a banana leaf.
A017|Indian|Karnataka|104|Folklore & myth||yes||yes||https://c8.alamy.com/comp/2RFKHA9/a-beautifully-colored-sculpture-showing-shri-krishna-as-a-charioteer-preaching-to-arjuna-during-the-mahabharata-war-different-angles-and-focus-2RFKHA9.jpg|krishna preaching in mahabharat|6|Another very popular epic is Mahabharata which is about fight between two branches of a king for getting control of a kingdom. Lord Krishna is one of the character in this epic. Image shows him preaching Arjuna.
A017|Indian|Karnataka|27|body adornment|Tattoos|yes||yes||https://www.weddingplz.com/blog/wp-content/uploads/2015/05/Belief.weddingplz.jpg|sindur   of a married woman|19|Sindoor, a red powder, is the mark of a married woman in Hinduism. Single women wear the bindi in different colours for special occasions but don't apply sindoor in their parting of the hairline. Widows do not wear sindoor or bindis, signifying that their husband is no longer alive.
A017|Indian|Karnataka|98|emotions|Relief|yes||yes||https://www.chamundaswamiji.com/wp-content/uploads/2022/10/bd5ffcf8dca69193d0418ec6674f9e1e.jpg|saffron robes monk |2|Saffron, which conveys sanctity, is the most sacred color, and can be found on the robes warn by Hindu monks.
A009|Indian|NEW DELHI|40|color symbolism|Energetic|yes||yes||https://i.ebayimg.com/images/g/l9MAAOSwDgRjXCUS/s-l1200.jpg|indian bride in red saree|3|In India, the color red is synonymous with energy and passion. Brides often adorn themselves in red sarees on their wedding day, a testament to their vibrant and enthusiastic spirit.
A009|Indian|NEW DELHI|73|cooking|Special Event foods|yes||yes||https://www.ramana-maharshi.org/wp-content/uploads/2024/01/aim_656_3.jpg|meals for special events in Indian culture|11|Hinduism, a culture rich in spiritual and philosophical traditions, places significant importance on the connection between food and health. The Vedas, revered ancient scriptures, provide detailed dietary recommendations that were tailored to the socio-environmental context of the time and were also in harmony with Hindu spiritual principles.
A009|Indian|NEW DELHI|104|Folklore & myth||yes||yes||https://img10.hotstar.com/image/upload/f_auto/sources/r1/cms/prod/9020/1379020-i-d0651a139485|Mahabharata|4|The Mahabharata, a monumental epic, delves into profound themes of dharma, family, love, war, and political intrigue. It narrates the legendary conflict between the Pandava and Kaurava clans and is renowned for the profound teachings imparted by Lord Krishna.
A009|Indian|NEW DELHI|27|body adornment|Tattoos|yes||yes||https://media.weddingz.in/images/d4d1c5c3e15d298ad37c0ab79cfc0bb4/Henna-for-all-5.jpg|bridal mehndi design|11|Bridal mehendi/henna/tattoo, a beloved pre-wedding ritual in Indian cultures, is a celebration of beauty and tradition. Intricate henna designs adorn the bride's hands and feet, carrying deep cultural and spiritual meaning.

The timeless art of henna finds its most exquisite expression in bridal mehendi. Intricate designs, like delicate lacework, adorn the bride's hands and feet, symbolizing beauty, love, and the auspicious start of a new chapter.
A009|Indian|NEW DELHI|98|emotions|Relief|yes||yes||https://media.weddingz.in/images/d4d1c5c3e15d298ad37c0ab79cfc0bb4/Henna-for-all-5.jpg|bridal mehndi design|11|The timeless art of henna finds its most exquisite expression in bridal mehendi. Intricate designs, like delicate lacework, adorn the bride's hands and feet, symbolizing beauty, love, and the auspicious start of a new chapter.

Bridal mehendi, a masterpiece of henna artistry, transforms the bride's hands and feet into canvases of beauty and love. Intricate designs, like delicate lacework, adorn her limbs, marking the auspicious beginning of a new chapter.
